{
  "schema_version": 1,
  "generated_at": "2026-10-02T19:53:27.588Z",
  "planning_only": true,
  "projects_evaluated": 17,
  "collisions": [],
  "entries": [
    {
      "project_id": "chalwa.id",
      "action_id": "queue-chalwa-inventory",
      "action_type": "READ_ONLY_INVENTORY",
      "objective": "Run read-only repository and environment inventory against the CHALWA implementation plan",
      "classification": "PARALLEL",
      "mode": "READ_ONLY",
      "dependencies": [],
      "permission_level": "L0",
      "approvals": [],
      "readiness": "AUTONOMOUS_BUILD_READY",
      "risk": "low",
      "environment_available": true,
      "shared_capability_context": [
        {
          "capability_id": "authentication",
          "classification": "CANDIDATE_SHARED",
          "owner_status": "UNCLEAR",
          "provider_project": "afuza.id"
        },
        {
          "capability_id": "ai-generation",
          "classification": "CANDIDATE_SHARED",
          "owner_status": "UNCLEAR",
          "provider_project": "afuza.id"
        },
        {
          "capability_id": "publishing",
          "classification": "SHARED_CORE",
          "owner_status": "CLEAR",
          "provider_project": "afuza.id"
        }
      ],
      "shared_capability_leverage": "medium",
      "decision_id": null,
      "bootstrap_scope": null,
      "target_path": null,
      "target_path_available": true,
      "expected_outputs": [],
      "stop_conditions": [],
      "blockers": [],
      "resource_scopes": [],
      "repository_path": "/home/afuzaid/apps/chalwa",
      "repository_paths": [],
      "infrastructure_mutation": false,
      "infrastructure_scopes": [],
      "parallel_safe": true,
      "collision_reasons": [],
      "reason": "Read-only action is independently eligible for parallel execution."
    },
    {
      "project_id": "klodhost",
      "action_id": "queue-klodhost-inventory",
      "action_type": "READ_ONLY_INVENTORY",
      "objective": "Run read-only repository inventory and classify GREENFIELD / EXISTING_PARTIAL / EXISTING_CONFLICTING",
      "classification": "PARALLEL",
      "mode": "READ_ONLY",
      "dependencies": [],
      "permission_level": "L0",
      "approvals": [],
      "readiness": "AUTONOMOUS_BUILD_READY",
      "risk": "low",
      "environment_available": true,
      "shared_capability_context": [
        {
          "capability_id": "payments-billing",
          "classification": "UNKNOWN",
          "owner_status": "UNASSIGNED",
          "provider_project": null
        },
        {
          "capability_id": "observability",
          "classification": "UNKNOWN",
          "owner_status": "UNASSIGNED",
          "provider_project": null
        }
      ],
      "shared_capability_leverage": "medium",
      "decision_id": null,
      "bootstrap_scope": null,
      "target_path": null,
      "target_path_available": true,
      "expected_outputs": [],
      "stop_conditions": [],
      "blockers": [],
      "resource_scopes": [],
      "repository_path": "/home/afuzaid/apps/klodhost",
      "repository_paths": [],
      "infrastructure_mutation": false,
      "infrastructure_scopes": [],
      "parallel_safe": true,
      "collision_reasons": [],
      "reason": "Read-only action is independently eligible for parallel execution."
    },
    {
      "project_id": "marketing-agency",
      "action_id": "queue-marketing-phase0-inventory",
      "action_type": "READ_ONLY_INVENTORY",
      "objective": "Execute documented Phase 0 read-only real-infrastructure inventory",
      "classification": "PARALLEL",
      "mode": "READ_ONLY",
      "dependencies": [],
      "permission_level": "L0",
      "approvals": [],
      "readiness": "AUTONOMOUS_BUILD_READY",
      "risk": "low",
      "environment_available": true,
      "shared_capability_context": [
        {
          "capability_id": "authentication",
          "classification": "CANDIDATE_SHARED",
          "owner_status": "UNCLEAR",
          "provider_project": "afuza.id"
        },
        {
          "capability_id": "agent-runtime",
          "classification": "CANDIDATE_SHARED",
          "owner_status": "UNCLEAR",
          "provider_project": "afuza-ai"
        },
        {
          "capability_id": "lead-discovery",
          "classification": "CANDIDATE_SHARED",
          "owner_status": "UNCLEAR",
          "provider_project": "shared-acquisition-engine"
        },
        {
          "capability_id": "lead-scoring",
          "classification": "CANDIDATE_SHARED",
          "owner_status": "UNCLEAR",
          "provider_project": "shared-acquisition-engine"
        },
        {
          "capability_id": "qualification",
          "classification": "CANDIDATE_SHARED",
          "owner_status": "UNCLEAR",
          "provider_project": "shared-acquisition-engine"
        },
        {
          "capability_id": "approval-queue",
          "classification": "CANDIDATE_SHARED",
          "owner_status": "UNCLEAR",
          "provider_project": "ops.afuza.id"
        },
        {
          "capability_id": "outreach",
          "classification": "CANDIDATE_SHARED",
          "owner_status": "UNASSIGNED",
          "provider_project": null
        },
        {
          "capability_id": "whatsapp",
          "classification": "CANDIDATE_SHARED",
          "owner_status": "UNASSIGNED",
          "provider_project": null
        },
        {
          "capability_id": "acquisition-analytics",
          "classification": "CANDIDATE_SHARED",
          "owner_status": "UNCLEAR",
          "provider_project": "shared-acquisition-engine"
        },
        {
          "capability_id": "landing-page-generation",
          "classification": "CANDIDATE_SHARED",
          "owner_status": "UNCLEAR",
          "provider_project": "afuza.id"
        },
        {
          "capability_id": "ai-generation",
          "classification": "CANDIDATE_SHARED",
          "owner_status": "UNCLEAR",
          "provider_project": "afuza.id"
        }
      ],
      "shared_capability_leverage": "medium",
      "decision_id": null,
      "bootstrap_scope": null,
      "target_path": null,
      "target_path_available": true,
      "expected_outputs": [],
      "stop_conditions": [],
      "blockers": [],
      "resource_scopes": [],
      "repository_path": "/home/afuzaid/apps/marketing-agency",
      "repository_paths": [],
      "infrastructure_mutation": false,
      "infrastructure_scopes": [],
      "parallel_safe": true,
      "collision_reasons": [],
      "reason": "Read-only action is independently eligible for parallel execution."
    },
    {
      "project_id": "shared-acquisition-engine",
      "action_id": "queue-acquisition-prd",
      "action_type": "HUMAN_APPROVAL",
      "objective": "Resolve scoring and outbound approval policy conflicts",
      "classification": "HUMAN_DECISION",
      "mode": "MUTATING",
      "dependencies": [],
      "permission_level": "L5",
      "approvals": [],
      "readiness": "SPEC_INCOMPLETE",
      "risk": "high",
      "environment_available": false,
      "shared_capability_context": [
        {
          "capability_id": "lead-discovery",
          "classification": "CANDIDATE_SHARED",
          "owner_status": "UNCLEAR",
          "provider_project": "shared-acquisition-engine"
        },
        {
          "capability_id": "lead-scoring",
          "classification": "CANDIDATE_SHARED",
          "owner_status": "UNCLEAR",
          "provider_project": "shared-acquisition-engine"
        },
        {
          "capability_id": "qualification",
          "classification": "CANDIDATE_SHARED",
          "owner_status": "UNCLEAR",
          "provider_project": "shared-acquisition-engine"
        },
        {
          "capability_id": "approval-queue",
          "classification": "CANDIDATE_SHARED",
          "owner_status": "UNCLEAR",
          "provider_project": "ops.afuza.id"
        },
        {
          "capability_id": "outreach",
          "classification": "CANDIDATE_SHARED",
          "owner_status": "UNASSIGNED",
          "provider_project": null
        },
        {
          "capability_id": "whatsapp",
          "classification": "CANDIDATE_SHARED",
          "owner_status": "UNASSIGNED",
          "provider_project": null
        },
        {
          "capability_id": "acquisition-analytics",
          "classification": "CANDIDATE_SHARED",
          "owner_status": "UNCLEAR",
          "provider_project": "shared-acquisition-engine"
        }
      ],
      "shared_capability_leverage": "high",
      "decision_id": null,
      "bootstrap_scope": null,
      "target_path": null,
      "target_path_available": true,
      "expected_outputs": [],
      "stop_conditions": [],
      "blockers": [
        "No consolidated authoritative acquisition PRD identified.",
        "Scoring policy conflicts across source docs and implementation.",
        "Outbound approval/send policy conflicts across workflow docs and implementation.",
        "No consolidated approved PRD.",
        "Scoring and outbound policy conflicts unresolved.",
        "Implementation evidence is in a dirty worktree."
      ],
      "resource_scopes": [],
      "repository_path": "/home/afuzaid/engineering/repos/afuza-id/src/lib/acquisition",
      "repository_paths": [],
      "infrastructure_mutation": false,
      "infrastructure_scopes": [],
      "parallel_safe": false,
      "collision_reasons": [],
      "reason": "Action requires human authorization."
    },
    {
      "project_id": "afuza.ecosystem",
      "action_id": "queue-portfolio-source-sync",
      "action_type": "IMPLEMENT",
      "objective": "Inspect registered Drive PRD/spec contents and reconcile acceptance criteria",
      "classification": "EXTERNAL_SOURCE_REQUIRED",
      "mode": "MUTATING",
      "dependencies": [],
      "permission_level": "L1",
      "approvals": [],
      "readiness": "DISCOVERED",
      "risk": "low",